{
  "schema_version": "1.0",
  "synthetic": true,
  "description": "Invented normalized server spans for an offline walkthrough. Not real telemetry.",
  "spans": [
    {
      "run_id": "synthetic-demo-001",
      "trace_id": "trace-healthy",
      "span_id": "span-1",
      "parent_span_id": null,
      "service": "frontend",
      "kind": "SERVER",
      "start_time_ms": 1790000000000,
      "duration_ms": 12,
      "status": "OK",
      "phase": "healthy"
    },
    {
      "run_id": "synthetic-demo-001",
      "trace_id": "trace-healthy",
      "span_id": "span-2",
      "parent_span_id": "span-1",
      "service": "checkoutservice",
      "kind": "SERVER",
      "start_time_ms": 1790000000001,
      "duration_ms": 8,
      "status": "OK",
      "phase": "healthy"
    },
    {
      "run_id": "synthetic-demo-001",
      "trace_id": "trace-healthy",
      "span_id": "span-3",
      "parent_span_id": "span-2",
      "service": "cartservice",
      "kind": "SERVER",
      "start_time_ms": 1790000000002,
      "duration_ms": 3,
      "status": "OK",
      "phase": "healthy"
    },
    {
      "run_id": "synthetic-demo-001",
      "trace_id": "trace-fault",
      "span_id": "span-1",
      "parent_span_id": null,
      "service": "frontend",
      "kind": "SERVER",
      "start_time_ms": 1790000060000,
      "duration_ms": 360,
      "status": "ERROR",
      "phase": "fault"
    },
    {
      "run_id": "synthetic-demo-001",
      "trace_id": "trace-fault",
      "span_id": "span-2",
      "parent_span_id": "span-1",
      "service": "checkoutservice",
      "kind": "SERVER",
      "start_time_ms": 1790000060001,
      "duration_ms": 320,
      "status": "ERROR",
      "phase": "fault"
    },
    {
      "run_id": "synthetic-demo-001",
      "trace_id": "trace-fault",
      "span_id": "span-3",
      "parent_span_id": "span-2",
      "service": "cartservice",
      "kind": "SERVER",
      "start_time_ms": 1790000060002,
      "duration_ms": 280,
      "status": "ERROR",
      "phase": "fault"
    },
    {
      "run_id": "synthetic-demo-001",
      "trace_id": "trace-recovery",
      "span_id": "span-1",
      "parent_span_id": null,
      "service": "frontend",
      "kind": "SERVER",
      "start_time_ms": 1790000120000,
      "duration_ms": 14,
      "status": "OK",
      "phase": "recovery"
    },
    {
      "run_id": "synthetic-demo-001",
      "trace_id": "trace-recovery",
      "span_id": "span-2",
      "parent_span_id": "span-1",
      "service": "checkoutservice",
      "kind": "SERVER",
      "start_time_ms": 1790000120001,
      "duration_ms": 9,
      "status": "OK",
      "phase": "recovery"
    },
    {
      "run_id": "synthetic-demo-001",
      "trace_id": "trace-recovery",
      "span_id": "span-3",
      "parent_span_id": "span-2",
      "service": "cartservice",
      "kind": "SERVER",
      "start_time_ms": 1790000120002,
      "duration_ms": 4,
      "status": "OK",
      "phase": "recovery"
    }
  ]
}
